{
  "version": "1.0.0",
  "metadata": {
    "name": "ampa_prd_workflow",
    "description": "PRD-driven work item workflow for the AMPA engine. Covers the full lifecycle from idea capture through implementation, audit, and closure. Supports both manual (human-driven) and AMPA-delegated (agent-driven) execution paths.",
    "owner": "workflow-team",
    "links": {
      "specification": "workflow-language.md",
      "lifecycle": "Workflow.md",
      "scheduler": "skill/install-ampa/.worklog/plugins/ampa_py/ampa/scheduler.py"
    },
    "roles": [
      {
        "name": "Producer",
        "description": "Human stakeholder who owns the project vision, approves work items for closure, and gates human-review steps. Cannot be replaced by an agent.",
        "type": "human"
      },
      {
        "name": "PM",
        "description": "Product manager (human or agent) responsible for intake, PRD authoring, and planning. In the AMPA engine, this role is filled by the AMPA scheduler.",
        "type": "either"
      },
      {
        "name": "Patch",
        "description": "Developer/implementer agent that receives delegated work and implements it autonomously using the implement skill. Reports completion back.",
        "type": "agent"
      },
      {
        "name": "QA",
        "description": "Quality assurance role that runs audits via the audit skill to verify acceptance criteria are met. In the AMPA engine, this is executed by AMPA.",
        "type": "agent"
      },
      {
        "name": "DevOps",
        "description": "Handles CI/CD, deployment, and infrastructure concerns. Manages build pipelines, feature flags, and rollback procedures.",
        "type": "either"
      },
      {
        "name": "TechnicalWriter",
        "description": "Produces and maintains documentation, READMEs, and user-facing guides.",
        "type": "either"
      }
    ]
  },
  "status": [
    "open",
    "in_progress",
    "blocked",
    "completed",
    "closed"
  ],
  "stage": [
    "idea",
    "intake_complete",
    "prd_complete",
    "plan_complete",
    "delegated",
    "in_progress",
    "in_review",
    "audit_passed",
    "audit_failed",
    "escalated",
    "done"
  ],
  "states": {
    "idea": {
      "status": "open",
      "stage": "idea"
    },
    "intake": {
      "status": "open",
      "stage": "intake_complete"
    },
    "prd": {
      "status": "open",
      "stage": "prd_complete"
    },
    "plan": {
      "status": "open",
      "stage": "plan_complete"
    },
    "building": {
      "status": "in_progress",
      "stage": "in_progress"
    },
    "review": {
      "status": "in_progress",
      "stage": "in_review"
    },
    "shipped": {
      "status": "closed",
      "stage": "done"
    },
    "delegated": {
      "status": "in_progress",
      "stage": "delegated"
    },
    "audit_passed": {
      "status": "completed",
      "stage": "audit_passed"
    },
    "audit_failed": {
      "status": "open",
      "stage": "audit_failed"
    },
    "escalated": {
      "status": "blocked",
      "stage": "escalated"
    },
    "blocked_in_progress": {
      "status": "blocked",
      "stage": "in_progress"
    },
    "blocked_delegated": {
      "status": "blocked",
      "stage": "delegated"
    }
  },
  "terminal_states": [
    "shipped"
  ],
  "invariants": [
    {
      "name": "requires_prd_link",
      "description": "PRD URL must be present in description before planning can begin.",
      "when": "pre",
      "logic": "regex(description, \"PRD:\\\\s*https?://\")"
    },
    {
      "name": "requires_tests",
      "description": "Test plan link must exist before entering review.",
      "when": "pre",
      "logic": "regex(description, \"Test Plan:\\\\s*https?://\")"
    },
    {
      "name": "requires_approvals",
      "description": "At least one reviewer must have approved before closing.",
      "when": "post",
      "logic": "regex(comments, \"Approved by\\\\s+\\\\w+\")"
    },
    {
      "name": "requires_work_item_context",
      "description": "Work item must have a non-empty description with sufficient context for autonomous implementation. Checked before delegation.",
      "when": "pre",
      "logic": "length(description) > 100"
    },
    {
      "name": "requires_acceptance_criteria",
      "description": "Work item must contain acceptance criteria (checkbox list or explicit section) so the audit can verify completion.",
      "when": "pre",
      "logic": "regex(description, \"(?i)(acceptance criteria|success criteria|\\\\- \\\\[ x]\\\\])\")"
    },
    {
      "name": "requires_stage_for_delegation",
      "description": "Work item stage must be one of idea, intake_complete, or plan_complete before AMPA can delegate. Matches scheduler.py stage gate.",
      "when": "pre",
      "logic": "stage in [\"idea\", \"intake_complete\", \"plan_complete\"]"
    },
    {
      "name": "not_do_not_delegate",
      "description": "Work item must not be tagged do-not-delegate. Matches scheduler.py _is_do_not_delegate check.",
      "when": "pre",
      "logic": "\"do-not-delegate\" not in tags and \"do_not_delegate\" not in tags"
    },
    {
      "name": "no_in_progress_items",
      "description": "No other work items may be in_progress when delegating. Matches scheduler.py single-concurrency constraint.",
      "when": "pre",
      "logic": "count(work_items, status=\"in_progress\") == 0"
    },
    {
      "name": "requires_audit_result",
      "description": "An audit comment from the audit skill must exist on the work item confirming whether acceptance criteria are met.",
      "when": "pre",
      "logic": "regex(comments, \"(?i)AMPA Audit Result\")"
    },
    {
      "name": "audit_recommends_closure",
      "description": "The most recent audit comment must recommend closure (all acceptance criteria met). Checked before close_with_audit.",
      "when": "pre",
      "logic": "regex(comments, \"(?i)(can this item be closed\\\\?\\\\s*yes|all acceptance criteria.*(met|satisfied))\")"
    },
    {
      "name": "audit_does_not_recommend_closure",
      "description": "The most recent audit comment must NOT recommend closure (gaps found). Checked before escalation or retry.",
      "when": "pre",
      "logic": "regex(comments, \"(?i)can this item be closed\\\\?\\\\s*no\")"
    }
  ],
  "commands": {
    "intake": {
      "description": "Capture intake details for a new idea. Expands the initial idea into a structured feature intake with motivation, user impact, and requirements. Maps to Workflow.md \"Intake\" step.",
      "from": [
        "idea"
      ],
      "to": "intake",
      "actor": "PM",
      "inputs": {
        "summary": {
          "type": "string",
          "required": true,
          "description": "Brief summary of the intake findings."
        }
      },
      "effects": {
        "add_tags": [
          "intake"
        ]
      }
    },
    "author_prd": {
      "description": "Produce a PRD draft and link it to the work item. Maps to Workflow.md \"Intake\" step (PRD authoring phase).",
      "from": [
        "intake"
      ],
      "to": "prd",
      "actor": "PM",
      "pre": [
        "requires_prd_link"
      ]
    },
    "plan": {
      "description": "Decompose the work into sub-epics and features with acceptance criteria. Maps to Workflow.md \"Plan\" step.",
      "from": [
        "intake",
        "prd"
      ],
      "to": "plan",
      "actor": "PM",
      "effects": {
        "add_tags": [
          "planned"
        ]
      }
    },
    "start_build": {
      "description": "Begin manual implementation on a planned feature. Used when a human developer (not AMPA delegation) picks up work. Maps to Workflow.md \"Implementation\" step.",
      "from": [
        "plan"
      ],
      "to": "building",
      "actor": "Patch",
      "effects": {
        "add_tags": [
          "in_progress"
        ]
      }
    },
    "block": {
      "description": "Mark a work item as blocked with a reason (from building state).",
      "from": [
        "building"
      ],
      "to": "blocked_in_progress",
      "actor": "Patch",
      "inputs": {
        "reason": {
          "type": "string",
          "required": true,
          "description": "Explanation of what is blocking progress."
        }
      }
    },
    "block_delegated": {
      "description": "Mark a delegated work item as blocked with a reason.",
      "from": [
        "delegated"
      ],
      "to": "blocked_delegated",
      "actor": "Patch",
      "inputs": {
        "reason": {
          "type": "string",
          "required": true,
          "description": "Explanation of what is blocking progress."
        }
      }
    },
    "unblock": {
      "description": "Resume building work after resolving a blocker.",
      "from": [
        "blocked_in_progress"
      ],
      "to": "building",
      "actor": "Patch"
    },
    "unblock_delegated": {
      "description": "Resume delegated work after resolving a blocker.",
      "from": [
        "blocked_delegated"
      ],
      "to": "delegated",
      "actor": "Patch"
    },
    "submit_review": {
      "description": "Submit completed work for code/feature review. Maps to Workflow.md \"PR Review\" step.",
      "from": [
        "building"
      ],
      "to": "review",
      "actor": "Patch",
      "pre": [
        "requires_tests"
      ]
    },
    "approve": {
      "description": "Approve reviewed work and mark as done. Maps to Workflow.md \"Cleanup\" step. Requires human Producer approval.",
      "from": [
        "review",
        "audit_passed"
      ],
      "to": "shipped",
      "actor": "Producer",
      "post": [
        "requires_approvals"
      ],
      "effects": {
        "set_needs_producer_review": false
      }
    },
    "reopen": {
      "description": "Reopen a closed item for follow-up work.",
      "from": [
        "shipped"
      ],
      "to": "plan",
      "actor": "Producer"
    },
    "delegate": {